TITLE,DESCRIPTION,PRICE,CURRENCY_CODE,QUANTITY,TAGS,MATERIALS,IMAGE1,IMAGE2,IMAGE3,IMAGE4,IMAGE5,VARIATION 1 TYPE,VARIATION 1 NAME,VARIATION 1 VALUES,VARIATION 2 TYPE,VARIATION 2 NAME,VARIATION 2 VALUES
"Champagne, Ivory, & Antique White Silk Satin Brooch Bridal Bouquet","Elegance has found its definition in this champagne, ivory, and antique white medium Elegance On The Avenue brooch bridal bouquet. Eight inches wide and ten-and-a-half inches tall, 80 silk and satin roses are crowned with amazing rhinestone brooches, both vintage and vintage look. There is even a crown brooch! The handle is clad in antique white, French-wrapped in 3/8 inch wide ivory satin, and topped with a champagne silk ribbon. The champagne ribbon roses are silk; the ivory and antique white roses are premium double face satin. This bouquet is certainly not suitable for tossing! Please don't!  We will send you a free tossing bouquet with your purchase.

Customize this model to you wedding needs or have it shipped to you as is. See Shop Policies. Contact Elegance On The Avenue for more information. 

2013 Elegance On The Avenue",395,USD,1,"Weddings,Bouquet,wedding,wedding_bouquet,wedding_flowers,bridal_bouquet,bouquet,champagne_bouquet,ivory_bouquet,brooch_bouquet,EleganceOnTheAvenue,antiquewhite_bouquet,bridal_party,wedding_party,elegant_bouquet","silk ribbon,satin ribbon,brooches",https://img1.etsystatic.com/015/0/7028242/il_fullxfull.444631117_7hb9.jpg,https://img1.etsystatic.com/013/0/7028242/il_fullxfull.444631289_r72i.jpg,https://img2.etsystatic.com/014/0/7028242/il_fullxfull.444626794_33zu.jpg,https://img0.etsystatic.com/015/0/7028242/il_fullxfull.444627116_sth6.jpg,https://img0.etsystatic.com/009/0/7028242/il_fullxfull.444627280_47ls.jpg,,,,,,
NEW Tussie Mussies Gold or Silver Mother's Day Bridal Party,"Looking for a Mother's Day gift? An elegant bridal party keepsake? An usual bouquet for your bridesmaids to carry? Consider our elegant tussie mussie holders with a bouquet in the colors of your choice. Gold or silver tone. Other styles available. Engraveable, too!

Message Elegance On The Avenue for more information. See Shop Policies.",45,USD,1,"Weddings,Bouquet,tussie_mussie,bridal_bouquet,bridesmaid_bouquet,Mothers_Day,Birthday,gift,wedding,wedding_party,gold_tussie_mussie,silver_tussie_mussie,small_bouqeut,bridal_party","tussie mussie,satin",https://img2.etsystatic.com/010/0/7028242/il_fullxfull.446489922_mwkn.jpg,https://img0.etsystatic.com/015/0/7028242/il_fullxfull.446490236_lgyv.jpg,https://img0.etsystatic.com/013/0/7028242/il_fullxfull.446491128_4a9x.jpg,https://img2.etsystatic.com/012/0/7028242/il_fullxfull.446491270_ox5v.jpg,https://img0.etsystatic.com/009/0/7028242/il_fullxfull.446496240_38ba.jpg,,,,,,
Two Rose Boutonnierres with Skeleton Leaves,"Shown here in pewter and champagne, these bouts have one large rose and one small rose. Also available with two small roses. This bout has a silver metallic skeleton leaf. Also available in gold metallic.

Customize to your wedding needs. See Shop Policies. Message Elegance On The Avenue for order information.",16.5,USD,1,"Weddings,Men,boutonnierre,men,groomsman,groom,father_of_bride,flower_bearer,EleganceOnTheAvenue,wedding,wedding_party,bridal_party","satin,skeleton leaves",https://img1.etsystatic.com/011/0/7028242/il_fullxfull.446498277_a854.jpg,https://img2.etsystatic.com/012/0/7028242/il_fullxfull.446493510_pe31.jpg,https://img3.etsystatic.com/012/0/7028242/il_fullxfull.446498711_tu4e.jpg,https://img3.etsystatic.com/012/0/7028242/il_fullxfull.446498903_4vwr.jpg,https://img2.etsystatic.com/012/0/7028242/il_fullxfull.446494006_bjd3.jpg,,,,,,
Red & Black Rose Bridal Bouquet with Feathers and Pearls,"SIxty red hand-rolled satin roses crowned with ivory pearls, sit upon red and black feathers to create a visually stunning bouquet. Bold and yet elegant, this bouquet is striking and memorable. The bouquet sits in a collar of feathers - red and black. The handle is clad in red, and French wrapped in sheer black, studded with black studs. This bouquet is a medium bouquet. 

Customize to your wedding needs. See shop policies. Message Elegance On The Avenue for more information and customization.",150,USD,1,"Weddings,Bouquet,red_bouquet,red_wedding_bouquet,red_bridal_bouquet,EleganceOnTheAvenue,red_rose_bouquet,bouquet,wedding_flowers,wedding_bouquet,bridal_bouquet,wedding,bride,bridal_party,bridesmaid","goose biots,satin,pearls",https://img2.etsystatic.com/014/0/7028242/il_fullxfull.437867306_6gyr.jpg,https://img0.etsystatic.com/015/0/7028242/il_fullxfull.437867420_9t4m.jpg,https://img2.etsystatic.com/014/0/7028242/il_fullxfull.437867786_bmy2.jpg,https://img2.etsystatic.com/014/0/7028242/il_fullxfull.437868778_4466.jpg,https://img2.etsystatic.com/010/0/7028242/il_fullxfull.437868818_ckxe.jpg,,,,,,
